{
  "schema_version": "1.0",
  "message_id": "otamsg_available",
  "device_id": 33,
  "hardware_device_id": "pl-esp32-64e0a80af6e8",
  "node_role": "master",
  "message_type": "OTA_STATUS",
  "sent_at": "2026-05-27T12:00:30Z",
  "payload": {
    "command_id": "cmd_ota_123",
    "status": "available",
    "progress_percent": 0,
    "current_version": "1.1.0",
    "target_version": "1.2.0",
    "firmware_channel": "beta",
    "phase": "check",
    "message": "Firmware update is available",
    "release_id": "master-1.2.0-beta"
  }
}
