{
  "schema_version": "1.0",
  "message_id": "cmdmsg_01HXLIGHT",
  "device_id": 33,
  "hardware_device_id": "pl-esp32-64e0a80af6e8",
  "node_role": "master",
  "message_type": "COMMAND",
  "sent_at": "2026-05-27T12:00:00Z",
  "payload": {
    "command_id": "cmd_01HXLIGHT",
    "command_type": "SET_GROW_LIGHT_BRIGHTNESS",
    "target": {
      "node_role": "master",
      "hardware_device_id": "pl-esp32-64e0a80af6e8"
    },
    "params": {
      "brightness_percent": 65
    },
    "timeout_ms": 20000,
    "priority": "normal",
    "scheduled_for": null
  }
}
