{
  "schema_version": "1.0",
  "message_id": "cmdmsg_01HXCAPTURE",
  "device_id": 33,
  "hardware_device_id": "pl-esp32-64e0a80af6e8",
  "node_role": "master",
  "message_type": "COMMAND",
  "sent_at": "2026-05-27T12:00:00Z",
  "payload": {
    "command_id": "cmd_01HXCAPTURE",
    "command_type": "CAPTURE_IMAGE",
    "target": {
      "node_role": "camera",
      "hardware_device_id": "pl-cam-1c1df816a398"
    },
    "params": {
      "reason": "manual"
    },
    "timeout_ms": 120000,
    "retry_policy": {
      "max_attempts": 3,
      "backoff_ms": 3000
    },
    "priority": "normal",
    "scheduled_for": null
  }
}
