{
  "schema_version": "1.0",
  "message_id": "cmdresmsg_01HXSUCCESS",
  "device_id": 33,
  "hardware_device_id": "pl-cam-1c1df816a398",
  "node_role": "camera",
  "message_type": "COMMAND_RESULT",
  "sent_at": "2026-05-27T12:00:10Z",
  "payload": {
    "command_id": "cmd_01HXCAPTURE",
    "command_type": "CAPTURE_IMAGE",
    "status": "completed",
    "message": "image uploaded",
    "result": {
      "image_id": 991,
      "upload_ms": 1836
    },
    "error_code": null
  }
}
